[
  {
    "name": "LAVA",
    "description": "Standard wilderness and dungeon lava flats.",
    "crustColor": "#1f0603",
    "magmaColor": "#e0440c",
    "hotColor": "#f05518",
    "duration": 8.5,
    "animSpeed": 1.65,
    "scale": 3.35,
    "crustThreshold": 0.42,
    "crustAmount": 0.38,
    "crustSharpness": 0.86,
    "flowStrength": 1.85,
    "waveStrength": 0.26,
    "emissiveStrength": 1.35,
    "surfaceGlow": 0.75,
    "irradianceStrength": 1.0,
    "specularStrength": 0.1,
    "specularGloss": 10.0,
    "light": {
      "radius": 400,
      "strength": 34,
      "height": 20,
      "color": [
        254,
        182,
        34
      ],
      "type": "PULSE",
      "duration": 7000,
      "range": 10,
      "spacing": 640
    }
  },
  {
    "name": "MAGMA",
    "description": "Hotter, faster-moving magma pools.",
    "crustColor": "#1f0603",
    "magmaColor": "#e0440c",
    "hotColor": "#f05518",
    "duration": 6.5,
    "animSpeed": 1.85,
    "scale": 2.85,
    "crustThreshold": 0.36,
    "crustAmount": 0.44,
    "crustSharpness": 0.8,
    "flowStrength": 1.6,
    "waveStrength": 0.32,
    "emissiveStrength": 1.2,
    "surfaceGlow": 0.8,
    "irradianceStrength": 1.1,
    "specularStrength": 0.08,
    "specularGloss": 8.0,
    "light": {
      "alignment": "CENTER",
      "radius": 108,
      "strength": 9,
      "color": [
        252,
        122,
        3
      ],
      "type": "FLICKER",
      "duration": 0,
      "range": 20,
      "spacing": 416
    }
  },
  {
    "name": "TZHAAR_LAVA",
    "description": "TzHaar city and Fight Caves lava (used via TZHAAR_LAVA ground material).",
    "crustColor": "#0c0202",
    "magmaColor": "#d41008",
    "hotColor": "#ff2818",
    "duration": 7.5,
    "animSpeed": 1.7,
    "scale": 3.0,
    "crustThreshold": 0.34,
    "crustAmount": 0.36,
    "crustSharpness": 0.88,
    "flowStrength": 1.75,
    "waveStrength": 0.28,
    "emissiveStrength": 1.5,
    "surfaceGlow": 0.88,
    "irradianceStrength": 1.1,
    "specularStrength": 0.1,
    "specularGloss": 9.0,
    "light": {
      "radius": 425,
      "strength": 32,
      "height": 20,
      "color": [
        255,
        32,
        16
      ],
      "type": "PULSE",
      "duration": 6000,
      "range": 12,
      "spacing": 640
    }
  }
]
